{
  "schemaVersion": "1.0.0",
  "candidateId": "test-c10",
  "architectureId": "A10",
  "architectureFamily": "EVENT_DRIVEN_MICROSERVICES",
  "priorities": [
    {
      "metric": "p99_ms",
      "operator": "LTE",
      "target": 100,
      "weight": 0.45
    },
    {
      "metric": "monthly_cost_usd",
      "operator": "MIN",
      "weight": 0.3
    },
    {
      "metric": "scalability",
      "operator": "MAX",
      "weight": 0.25
    }
  ],
  "components": [
    "api-gateway",
    "user-service",
    "catalog-service",
    "inventory-service",
    "order-service",
    "event-worker",
    "payment-mock",
    "notification-mock",
    "postgres",
    "rabbitmq",
    "redis"
  ],
  "decisions": {
    "cache": {
      "enabled": true,
      "targets": [
        "product",
        "cart"
      ],
      "ttlSeconds": 60
    },
    "messaging": {
      "enabled": true,
      "broker": "RABBITMQ"
    },
    "scalingProfile": "ONE_PER_SERVICE",
    "communication": "AMQP_EVENT"
  },
  "assumptions": [
    "test"
  ],
  "rationale": [
    "test"
  ]
}
